{
  "schema_version": "1.0",
  "agent_id": "impl/spore/otel-foundation/1",
  "written_at": 1715038234,
  "status": "running",
  "current_task": "Adding OpenTelemetry tracing to spore/src/discovery.rs",
  "active_handoff": "spore-otel-foundation",
  "consecutive_failures": 0,
  "total_turns": 47,
  "pid": 12345,
  "session_id": "sess_abc123def456"
}
